{
  "$id": "https://schemas.amicode.dev/vault/cards/feedback.schema.json",
  "$schema": "https://json-schema.org/draft/2020-12/schema",
  "additionalProperties": true,
  "allOf": [
    {
      "if": {
        "properties": {
          "provenance_unrecoverable": {
            "const": true
          }
        },
        "required": [
          "provenance_unrecoverable"
        ]
      },
      "then": {
        "properties": {
          "provenance": {
            "maxItems": 0
          }
        },
        "required": [
          "reviewed_after"
        ]
      }
    }
  ],
  "properties": {
    "confidence": {
      "enum": [
        "low",
        "medium",
        "high"
      ]
    },
    "date": {
      "format": "date",
      "type": "string"
    },
    "description": {
      "minLength": 1,
      "type": "string"
    },
    "name": {
      "minLength": 1,
      "type": "string"
    },
    "provenance": {
      "items": {
        "type": "string"
      },
      "type": "array"
    },
    "provenance_unrecoverable": {
      "type": "boolean"
    },
    "review_by": {
      "format": "date",
      "type": "string"
    },
    "reviewed_after": {
      "minLength": 1,
      "type": "string"
    },
    "status": {
      "minLength": 1,
      "type": "string"
    },
    "subject": {
      "minLength": 1,
      "type": "string"
    },
    "tags": {
      "items": {
        "type": "string"
      },
      "type": "array"
    },
    "type": {
      "const": "feedback"
    }
  },
  "required": [
    "type",
    "name",
    "description"
  ],
  "title": "feedback card",
  "type": "object"
}
